{
  "versao": "3.0",
  "data_geracao": "2026-08-14",
  "metadados_projeto": {
    "tese_base": "SOARES, Maria Angélica Lau Pereira. Visão da Modernidade: A Presença Britânica no Gabinete de Leitura (1837-1838). 209f. Dissertação (Mestrado em Estudos Lingüísticos e Literários em Inglês) — Universidade de São Paulo, São Paulo, 2006.",
    "escopo": "Proveniência textual dos dez textos ficcionais britânicos identificados no Gabinete de Leitura (1837-1838) segundo a tese de Soares (2006).",
    "fonte_primaria": "TESE_MARIA_ANGELICA_LAU_PEREIRA_SOARES.pdf",
    "principio_filiacao": "Tese é fonte de verdade primária. JSONs anteriores (v2, v2.1, v2.2) são rascunhos e divergências foram registradas no relatorio_divergencias.md.",
    "paginacao": {
      "regra_global": "Não há offset universal garantido para toda a dissertação; nas páginas pré-textuais a distância varia.",
      "mapeamento_verificado": [
        {
          "secao": "Capítulo 6 (A nação britânica no Gabinete de Leitura)",
          "pagina_impressa_inicio": 76,
          "pagina_pdf_inicio": 84,
          "offset": 8,
          "metodo_verificacao": "Marcador 'Capítulo 6' encontrado no PDF p.84 = impressa p.76 (confirmado via pdftotext -layout)."
        }
      ],
      "instrucao_consumidor": "Cada evidência armazena explicitamente pagina_pdf_* e pagina_impressa_* quando disponíveis. Consumidores nunca devem derivar uma a partir da outra em tempo de execução."
    }
  },
  "vocabulario_controlado": {
    "tipos_no": [
      "Tese",
      "Periodico",
      "Giftbook",
      "Fasciculo",
      "PublicacaoSerializada",
      "ObraAbstrata",
      "ManifestacaoTextual",
      "Pessoa",
      "FonteDeclarada",
      "Trecho",
      "OperacaoTradutoria",
      "Evidencia",
      "Argumento",
      "Local"
    ],
    "tipos_aresta": [
      "AUTOR_DE",
      "MANIFESTA",
      "PUBLICADA_EM",
      "PERTENCE_A",
      "SERIALIZADA_EM",
      "PARTE_EM",
      "DECLARA_COMO_FONTE",
      "PUBLICADA_ORIGINALMENTE_EM",
      "RELACAO_DE_DEPENDENCIA_TEXTUAL",
      "INTERMEDIADA_POR",
      "TEM_VERSAO_FRANCESA_NA_REVUE",
      "NAO_E_FONTE_DIRETA_DE",
      "COMPARA_COM",
      "TEM_TRECHO",
      "AFETA",
      "SUSTENTA",
      "ANALISA"
    ],
    "status_epistemologico": [
      "documentado",
      "identificado",
      "inferido",
      "hipotese",
      "problematico",
      "nao_identificado"
    ]
  },
  "nos": [
    {
      "id": "tese:soares:2006",
      "tipo": "Tese",
      "titulo": "Visão da Modernidade — A presença britânica no Gabinete de Leitura (1837-1838)",
      "aliases": [
        "Dissertação Maria Angélica Lau Pereira Soares"
      ],
      "atributos": {
        "autora": "Maria Angélica Lau Pereira Soares",
        "ano": 2006,
        "instituicao": "USP / FFLCH / Departamento de Letras Modernas",
        "orientadora": "Sandra Guardini Teixeira Vasconcelos",
        "programa": "Pós-Graduação em Estudos Lingüísticos e Literários em Inglês"
      },
      "status_epistemologico": "documentado",
      "evidence_ids": [],
      "observacao": "Fonte primária deste grafo; seu conteúdo é a própria fonte de verdade. Por isso não possui evidence_ids (é a fonte)."
    },
    {
      "id": "periodico:gabinete-de-leitura",
      "tipo": "Periodico",
      "titulo": "Gabinete de Leitura, Serões das Famílias Brasileiras, Jornal para todas as Classes, Sexos e Idades",
      "aliases": [
        "Gabinete de Leitura"
      ],
      "atributos": {
        "local": "Rio de Janeiro",
        "periodo_inicio": "1837-08-13",
        "periodo_fim": "1838-04-08",
        "total_numeros": 35,
        "frequencia": "semanal (aos domingos)",
        "subscricao_anual_rs": 6000
      },
      "status_epistemologico": "documentado",
      "evidence_ids": [
        "evidence:soares:2006:pdf-p9-12:redatores-gabinete"
      ],
      "observacao": null
    },
    {
      "id": "periodico:o-chronista",
      "tipo": "Periodico",
      "titulo": "O Chronista",
      "aliases": [
        "O Chronista (1836-1839)"
      ],
      "atributos": {
        "local": "Rio de Janeiro",
        "periodo_inicio": "1836",
        "periodo_fim": "1839",
        "frequencia": "bi-semanal em 1837 (qua/sáb); tri-semanal a partir de jan/1838 (ter/qui/sáb)"
      },
      "status_epistemologico": "documentado",
      "evidence_ids": [
        "evidence:soares:2006:pdf-p9-12:redatores-gabinete",
        "evidence:soares:2006:pdf-p12-13:livro-da-vida-republicacao-chronista"
      ],
      "observacao": "Periódico irmão do Gabinete de Leitura, com o qual compartilha tipografia e redatores prováveis."
    },
    {
      "id": "periodico:new-monthly-magazine",
      "tipo": "Periodico",
      "titulo": "The New Monthly Magazine and Humorist",
      "aliases": [
        "The New Monthly and Literary Journal",
        "New Monthly Magazine"
      ],
      "atributos": {
        "local": "Londres",
        "editores_relevantes": [
          "Edward Bulwer-Lytton (1831-1833)",
          "Theodore Hook (época de 1837)",
          "Henry Colburn (proprietário)"
        ]
      },
      "status_epistemologico": "documentado",
      "evidence_ids": [
        "evidence:soares:2006:pdf-p103-111:costumes-comparacao",
        "evidence:soares:2006:pdf-p100-103:honras-comparacao",
        "evidence:soares:2006:pdf-p95-97:alibi-apresentacao"
      ],
      "observacao": "Veículo original de Costumes Ingleses, As Honras Hereditárias e Álibi."
    },
    {
      "id": "periodico:blackwoods-magazine",
      "tipo": "Periodico",
      "titulo": "Blackwood's Magazine",
      "aliases": [
        "Blackwood Magazine"
      ],
      "atributos": {
        "local": "Edimburgo / Londres"
      },
      "status_epistemologico": "documentado",
      "evidence_ids": [
        "evidence:soares:2006:pdf-p91:uma-noite-no-mar-original"
      ],
      "observacao": "Veículo original da série de cinco episódios incl. 'Davy Jones and the Yankee Privateer'."
    },
    {
      "id": "periodico:the-metropolitan",
      "tipo": "Periodico",
      "titulo": "The Metropolitan",
      "aliases": [],
      "atributos": {
        "local": "Londres"
      },
      "status_epistemologico": "documentado",
      "evidence_ids": [
        "evidence:soares:2006:pdf-p97-98:esbocos-apresentacao"
      ],
      "observacao": "Veículo original de 'Sicilian Facts'. Tese não fornece data específica de publicação."
    },
    {
      "id": "periodico:revue-britannique",
      "tipo": "Periodico",
      "titulo": "Revue Britannique",
      "aliases": [],
      "atributos": {
        "local": "Paris"
      },
      "status_epistemologico": "documentado",
      "evidence_ids": [
        "evidence:soares:2006:pdf-p143-144:excecoes-revue-britannique",
        "evidence:soares:2006:pdf-p137-138:revue-britannique-le-cockney"
      ],
      "observacao": "Intermediária documentada para sete dos dez textos do corpus; não figura como rota para O Testamento, As Honras Hereditárias e Costumes Ingleses (exceções explícitas da tese)."
    },
    {
      "id": "giftbook:forget-me-not",
      "tipo": "Giftbook",
      "titulo": "Forget-me-Not; a Christmas and New Year's Present",
      "aliases": [
        "Forget-me-Not",
        "Forget me not"
      ],
      "atributos": {
        "local": "Londres",
        "periodo": "1823-1847",
        "editor": "R. Ackermann",
        "diretor": "Frederic Shobel",
        "observacao_editorial": "Primeiro gift book inglês (1823); destinado principalmente ao público feminino; vendido próximo ao fim de ano como presente; principal atrativo eram as gravuras feitas por profissionais de renome."
      },
      "status_epistemologico": "documentado",
      "evidence_ids": [
        "evidence:soares:2006:pdf-p93-95:terencio-original"
      ]
    },
    {
      "id": "giftbook:literary-souvenir",
      "tipo": "Giftbook",
      "titulo": "Literary Souvenir",
      "aliases": [
        "The Literary Souvenir"
      ],
      "atributos": {
        "local": "Londres",
        "periodo": "1825-1835",
        "observacao_editorial": "Um dos annuals / gift books mais famosos da Inglaterra."
      },
      "status_epistemologico": "documentado",
      "evidence_ids": [
        "evidence:soares:2006:pdf-p98-99:manuscrito-original"
      ]
    },
    {
      "id": "fasciculo:gabinete:02:1837-08-20",
      "tipo": "Fasciculo",
      "titulo": "Gabinete de Leitura n.2 — 1837-08-20",
      "aliases": [],
      "atributos": {
        "numero": 2,
        "data_iso": "1837-08-20",
        "veiculo": "Gabinete de Leitura",
        "papel": "publicacao"
      },
      "status_epistemologico": "documentado",
      "evidence_ids": [
        "evidence:soares:2006:pdf-p91-92:prosa-britanica-apresentacao"
      ],
      "observacao": null
    },
    {
      "id": "fasciculo:gabinete:06:1837-09-17",
      "tipo": "Fasciculo",
      "titulo": "Gabinete de Leitura n.6 — 1837-09-17",
      "aliases": [],
      "atributos": {
        "numero": 6,
        "data_iso": "1837-09-17",
        "veiculo": "Gabinete de Leitura",
        "papel": "publicacao"
      },
      "status_epistemologico": "documentado",
      "evidence_ids": [
        "evidence:soares:2006:pdf-p91-92:prosa-britanica-apresentacao"
      ],
      "observacao": null
    },
    {
      "id": "fasciculo:gabinete:08:1837-10-01",
      "tipo": "Fasciculo",
      "titulo": "Gabinete de Leitura n.8 — 1837-10-01",
      "aliases": [],
      "atributos": {
        "numero": 8,
        "data_iso": "1837-10-01",
        "veiculo": "Gabinete de Leitura",
        "papel": "publicacao"
      },
      "status_epistemologico": "documentado",
      "evidence_ids": [
        "evidence:soares:2006:pdf-p91-92:prosa-britanica-apresentacao"
      ],
      "observacao": null
    },
    {
      "id": "fasciculo:gabinete:09:1837-10-08",
      "tipo": "Fasciculo",
      "titulo": "Gabinete de Leitura n.9 — 1837-10-08",
      "aliases": [],
      "atributos": {
        "numero": 9,